{
  "schema": "skill-review-record/v1",
  "skill": "seo-keyword-article-planner",
  "reviewed_at": "2026-10-30T16:27:20Z",
  "target": {
    "files": [
      {
        "path": "SKILL.md",
        "sha256": "58228e612e33fc854a6a0b6bbd64b5e026f31731fce6a0ac53bee62abf23be38"
      },
      {
        "path": "references/article-outline-template.md",
        "sha256": "1193f58415b7b060ee62d706fea34c8dd0f9628cb600a696d4e5cf66becc6aed"
      },
      {
        "path": "references/outline-scorecard.md",
        "sha256": "9800921933f7f037736dd5f2b67e6383218547cc46002620c53d0f883d33ea90"
      }
    ],
    "content_hash": "9f3acd0ea50d0e2b4d29c9277449c82d321d902dd3d3951d86d1a1083c3afd6c"
  },
  "criteria": {
    "file": ".claude/skills/review-skill/criteria/skill-quality.json",
    "sha256": "58ca5348fd0c2d07f382ab4ffb5d3b6d546f756d638d1df6c01b2192afa32efb"
  },
  "best_practices_snapshot": {
    "fetched": "2026-10-27",
    "max_age_days": 30
  },
  "reviewer": {
    "kind": "subagent",
    "subagent_type": "general-purpose",
    "agent_id": "unavailable",
    "model": "claude-sonnet-5-5"
  },
  "result": {
    "axes": [
      {
        "id": "structure",
        "score": 19
      },
      {
        "id": "description",
        "score": 18
      },
      {
        "id": "instructions",
        "score": 18
      },
      {
        "id": "output",
        "score": 17
      },
      {
        "id": "practicality",
        "score": 18
      }
    ],
    "score": 90,
    "verdict": "PASS",
    "must_pass_failures": [],
    "findings": [
      {
        "criterion_id": "O1",
        "severity": "low",
        "location": "seo-keyword-article-planner/SKILL.md:139-157",
        "comment": "ステップ3の出力形式(テンプレート・表)が定義されていない。"
      },
      {
        "criterion_id": "D2",
        "severity": "low",
        "location": "seo-keyword-article-planner/SKILL.md:9-12",
        "comment": "トリガーフレーズが会計・確定申告に偏る。他テーマのフレーズは少ない。"
      }
    ]
  }
}
