{
  "schema": "skill-review-record/v1",
  "skill": "review-ops",
  "reviewed_at": "2026-10-30T16:07:14Z",
  "target": {
    "files": [
      {
        "path": "SKILL.md",
        "sha256": "bcd008c5a69610fae411d20cbe2fd88122e1767f3f3d03686c7fec83851597cf"
      },
      {
        "path": "references/output-format.md",
        "sha256": "24bae4de6d88a1245d93c3681a083fb6c4070be5df78a57feb2dca840382c29e"
      },
      {
        "path": "references/rubric.md",
        "sha256": "659cb70d42cbf96f07340aff54248926a41fe0a634f265d71550d69fa85c0368"
      }
    ],
    "content_hash": "c055f957205a3038dacf0949bc33d3afc8fce38e1f6ebbf4da2e161da1734b40"
  },
  "criteria": {
    "file": ".claude/skills/review-skill/criteria/skill-quality.json",
    "sha256": "58ca5348fd0c2d07f382ab4ffb5d3b6d546f756d638d1df6c01b2192afa32efb"
  },
  "best_practices_snapshot": {
    "fetched": "2026-10-27",
    "max_age_days": 30
  },
  "reviewer": {
    "kind": "subagent",
    "subagent_type": "general-purpose",
    "agent_id": "unavailable",
    "model": "claude-sonnet-5-5"
  },
  "result": {
    "axes": [
      {
        "id": "structure",
        "score": 19
      },
      {
        "id": "description",
        "score": 19
      },
      {
        "id": "instructions",
        "score": 18
      },
      {
        "id": "output",
        "score": 18
      },
      {
        "id": "practicality",
        "score": 17
      }
    ],
    "score": 91,
    "verdict": "PASS",
    "must_pass_failures": [],
    "findings": [
      {
        "criterion_id": "P3",
        "severity": "low",
        "location": "SKILL.md:34,96",
        "comment": "review-rubrics.yaml 等 repo 固有だが代替表あり(114行)"
      },
      {
        "criterion_id": "S1",
        "severity": "low",
        "location": "SKILL.md:137-143",
        "comment": "参照ドキュメント節が長め"
      }
    ]
  }
}
