{
  "schema": "skill-review-record/v1",
  "skill": "it-tech-news-research",
  "reviewed_at": "2026-10-30T15:45:50Z",
  "target": {
    "files": [
      {
        "path": "SKILL.md",
        "sha256": "3eec709fe5b7f44b300013abc6b993f770307ffdd887887fe1719a7c28474894"
      }
    ],
    "content_hash": "2ef4bae0c601422c20067fdc68be98733da458239faf63587d500888e87a4c3e"
  },
  "criteria": {
    "file": ".claude/skills/review-skill/criteria/skill-quality.json",
    "sha256": "58ca5348fd0c2d07f382ab4ffb5d3b6d546f756d638d1df6c01b2192afa32efb"
  },
  "best_practices_snapshot": {
    "fetched": "2026-10-27",
    "max_age_days": 30
  },
  "reviewer": {
    "kind": "subagent",
    "subagent_type": "general-purpose",
    "agent_id": "unavailable",
    "model": "claude-sonnet-5-5"
  },
  "result": {
    "axes": [
      {
        "id": "structure",
        "score": 19
      },
      {
        "id": "description",
        "score": 19
      },
      {
        "id": "instructions",
        "score": 19
      },
      {
        "id": "output",
        "score": 18
      },
      {
        "id": "practicality",
        "score": 17
      }
    ],
    "score": 92,
    "verdict": "PASS",
    "must_pass_failures": [],
    "findings": [
      {
        "criterion_id": "P3",
        "severity": "low",
        "location": "it-tech-news-research/SKILL.md:9",
        "comment": "general-news-research への参照は存在確認済み。地域がシアトル固定で他用途への流用は設定変更が要る。"
      }
    ]
  }
}
