{
  "schema": "skill-review-record/v1",
  "skill": "staged-investigation-workflow",
  "reviewed_at": "2026-10-30T16:09:23Z",
  "target": {
    "files": [
      {
        "path": "SKILL.md",
        "sha256": "3ecc399810feab02d0f800b33c2b328276f44c6aa20d2a27c21f4cf629993a2d"
      }
    ],
    "content_hash": "7818526aa801a52acb8f935511ce92b1a53e349daa153087cd19e780ccd53486"
  },
  "criteria": {
    "file": ".claude/skills/review-skill/criteria/skill-quality.json",
    "sha256": "58ca5348fd0c2d07f382ab4ffb5d3b6d546f756d638d1df6c01b2192afa32efb"
  },
  "best_practices_snapshot": {
    "fetched": "2026-10-27",
    "max_age_days": 30
  },
  "reviewer": {
    "kind": "subagent",
    "subagent_type": "general-purpose",
    "agent_id": "unavailable",
    "model": "claude-sonnet-5-5"
  },
  "result": {
    "axes": [
      {
        "id": "structure",
        "score": 18
      },
      {
        "id": "description",
        "score": 19
      },
      {
        "id": "instructions",
        "score": 18
      },
      {
        "id": "output",
        "score": 18
      },
      {
        "id": "practicality",
        "score": 17
      }
    ],
    "score": 90,
    "verdict": "PASS",
    "must_pass_failures": [],
    "findings": [
      {
        "criterion_id": "P3",
        "severity": "low",
        "location": "SKILL.md:16",
        "comment": "_shared/scripts への相対パス依存。前提条件に明記済みだがポータビリティは限定的"
      },
      {
        "criterion_id": "S1",
        "severity": "low",
        "location": "SKILL.md:1-139",
        "comment": "レポート・記録テンプレートを references に分離していない(約140行で許容範囲)"
      }
    ]
  }
}
