{
  "schema": "skill-review-record/v1",
  "skill": "thumbnail-generation",
  "reviewed_at": "2026-10-30T15:46:12Z",
  "target": {
    "files": [
      {
        "path": "SKILL.md",
        "sha256": "9ecd9d9679e89290cf39f8b1c89b28601fe669c2ba2d79b6432adfffa54c25b0"
      }
    ],
    "content_hash": "f04ca59df0c427b5ae198e093ed093895c3a50b3c4bdbfbc114ecdadacdf6182"
  },
  "criteria": {
    "file": ".claude/skills/review-skill/criteria/skill-quality.json",
    "sha256": "58ca5348fd0c2d07f382ab4ffb5d3b6d546f756d638d1df6c01b2192afa32efb"
  },
  "best_practices_snapshot": {
    "fetched": "2026-10-27",
    "max_age_days": 30
  },
  "reviewer": {
    "kind": "subagent",
    "subagent_type": "general-purpose",
    "agent_id": "unavailable",
    "model": "claude-sonnet-5-5"
  },
  "result": {
    "axes": [
      {
        "id": "structure",
        "score": 19
      },
      {
        "id": "description",
        "score": 19
      },
      {
        "id": "instructions",
        "score": 18
      },
      {
        "id": "output",
        "score": 17
      },
      {
        "id": "practicality",
        "score": 17
      }
    ],
    "score": 90,
    "verdict": "PASS",
    "must_pass_failures": [],
    "findings": [
      {
        "criterion_id": "P1",
        "severity": "low",
        "location": "SKILL.md:11",
        "comment": "allowed-tools が Read のみで、ブラウザ操作は別途 MCP 前提（L23 に前提記載あり）"
      },
      {
        "criterion_id": "O1",
        "severity": "low",
        "location": "SKILL.md:67-69",
        "comment": "完了報告は項目列挙のみで様式テンプレートは無い"
      }
    ]
  }
}
