{
  "schema": "skill-review-record/v1",
  "skill": "review-oss-contribution",
  "reviewed_at": "2026-10-30T16:27:06Z",
  "target": {
    "files": [
      {
        "path": "SKILL.md",
        "sha256": "fd109d769449b4c7b1ce5dcc12d3f4badcbc0fb6ed2233fc6b2a0a5019164fdd"
      },
      {
        "path": "criteria/oss-contribution.json",
        "sha256": "860fce029c725ae466623224aad2dbeabbf7302d68b6fdf8e6d408199bba720e"
      },
      {
        "path": "references/output-format.md",
        "sha256": "3a08595eda29b70ef00d22b2400a63e84abbb5a5aa527d20c719aac56ce18e22"
      },
      {
        "path": "references/rubric.md",
        "sha256": "66b01dd22d6ebb755a602c46b68a437622aee56e703b78ecbfa38c6885076d58"
      }
    ],
    "content_hash": "9acb1b0fc73325fe843d429e1f2f34e36cda08c654d6faf3cf496005c770a72e"
  },
  "criteria": {
    "file": ".claude/skills/review-skill/criteria/skill-quality.json",
    "sha256": "58ca5348fd0c2d07f382ab4ffb5d3b6d546f756d638d1df6c01b2192afa32efb"
  },
  "best_practices_snapshot": {
    "fetched": "2026-10-27",
    "max_age_days": 30
  },
  "reviewer": {
    "kind": "subagent",
    "subagent_type": "general-purpose",
    "agent_id": "unavailable",
    "model": "claude-sonnet-5-5"
  },
  "result": {
    "axes": [
      {
        "id": "structure",
        "score": 19
      },
      {
        "id": "description",
        "score": 19
      },
      {
        "id": "instructions",
        "score": 17
      },
      {
        "id": "output",
        "score": 18
      },
      {
        "id": "practicality",
        "score": 18
      }
    ],
    "score": 91,
    "verdict": "PASS",
    "must_pass_failures": [],
    "findings": [
      {
        "criterion_id": "I1",
        "severity": "medium",
        "location": "review-oss-contribution/SKILL.md:92-95; references/rubric.md:16-21",
        "comment": "判定規則は独自性が ❌ か ✅ の場合だけを定義し、独自性が △ の場合の総合判定が未定義。出力形式で独自性に △ が許されているため、判定が分かれ再現性を損なう。"
      },
      {
        "criterion_id": "P3",
        "severity": "low",
        "location": "review-oss-contribution/SKILL.md:38-39,66,89",
        "comment": ".claude/skills/... のリポジトリ固有パスが多いが、references/rubric.md による代替が明記されている。"
      }
    ]
  }
}
