{
  "schema": "skill-review-record/v1",
  "skill": "review-changes",
  "reviewed_at": "2026-10-30T16:26:54Z",
  "target": {
    "files": [
      {
        "path": "SKILL.md",
        "sha256": "4acefc644bb5949c0ae60d2660927803d22cf5682cb16fee2a5ad546267e3d0f"
      }
    ],
    "content_hash": "4cd54b6ca96afca3c9bcb850d126d37fbdd21a7a92726c8bcee1fd9ee3769168"
  },
  "criteria": {
    "file": ".claude/skills/review-skill/criteria/skill-quality.json",
    "sha256": "58ca5348fd0c2d07f382ab4ffb5d3b6d546f756d638d1df6c01b2192afa32efb"
  },
  "best_practices_snapshot": {
    "fetched": "2026-10-27",
    "max_age_days": 30
  },
  "reviewer": {
    "kind": "subagent",
    "subagent_type": "general-purpose",
    "agent_id": "unavailable",
    "model": "claude-sonnet-5-5"
  },
  "result": {
    "axes": [
      {
        "id": "structure",
        "score": 18
      },
      {
        "id": "description",
        "score": 19
      },
      {
        "id": "instructions",
        "score": 19
      },
      {
        "id": "output",
        "score": 18
      },
      {
        "id": "practicality",
        "score": 17
      }
    ],
    "score": 91,
    "verdict": "PASS",
    "must_pass_failures": [],
    "findings": [
      {
        "criterion_id": "S1",
        "severity": "low",
        "location": "SKILL.md:32-175",
        "comment": "評価基準・プロンプト・出力テンプレートが SKILL.md 一枚に同居し、references/ への分離 (Progressive Disclosure) が無い。"
      },
      {
        "criterion_id": "I4",
        "severity": "low",
        "location": "SKILL.md:125-126",
        "comment": "テスト基盤未検出なら軸2・軸3を 0 点とする規則は、ドキュメントのみの変更や設定のみの変更でも機械的に適用され、実態と合わない恐れがある。例外の記述が無い。"
      },
      {
        "criterion_id": "P2",
        "severity": "low",
        "location": "SKILL.md:205-208",
        "comment": "CLAUDE.md や README への登録反映は読み取った 2 つのパスだけでは確認できない。"
      },
      {
        "criterion_id": "P3",
        "severity": "low",
        "location": "SKILL.md:30,84",
        "comment": "readonly-reviewer 前提だが、general-purpose への代替が明記されており実害は小さい。"
      }
    ]
  }
}
