{
  "schema": "skill-review-record/v1",
  "skill": "review-business-idea",
  "reviewed_at": "2026-10-30T16:07:09Z",
  "target": {
    "files": [
      {
        "path": "SKILL.md",
        "sha256": "59dba587ed6d7d13fb76f93935427bb312db87b2f621876f4e99f2ac4747cbc8"
      },
      {
        "path": "references/review-prompt-template.md",
        "sha256": "ce50ab07d5e5f6d2b1c30f774876c6279f9829fef4656b5a18f17c5803ebf68a"
      }
    ],
    "content_hash": "b182cefb422a57dc95cfa31ab9afa3b035e37c5349ffd5b7333148d981f2b2d0"
  },
  "criteria": {
    "file": ".claude/skills/review-skill/criteria/skill-quality.json",
    "sha256": "58ca5348fd0c2d07f382ab4ffb5d3b6d546f756d638d1df6c01b2192afa32efb"
  },
  "best_practices_snapshot": {
    "fetched": "2026-10-27",
    "max_age_days": 30
  },
  "reviewer": {
    "kind": "subagent",
    "subagent_type": "general-purpose",
    "agent_id": "unavailable",
    "model": "claude-sonnet-5-5"
  },
  "result": {
    "axes": [
      {
        "id": "structure",
        "score": 19
      },
      {
        "id": "description",
        "score": 19
      },
      {
        "id": "instructions",
        "score": 17
      },
      {
        "id": "output",
        "score": 19
      },
      {
        "id": "practicality",
        "score": 16
      }
    ],
    "score": 90,
    "verdict": "PASS",
    "must_pass_failures": [],
    "findings": [
      {
        "criterion_id": "P3",
        "severity": "low",
        "location": "SKILL.md:22-25; references/review-prompt-template.md:21,157",
        "comment": "review-rubrics.yaml と readonly-reviewer への依存が repo 固有。テンプレート側には yaml 不在時のフォールバック記述が無く、SKILL.md 側の記述とのみ整合する。"
      },
      {
        "criterion_id": "I3",
        "severity": "low",
        "location": "SKILL.md:45-54",
        "comment": "使用例は1件、エッジケースも1件のみ。"
      },
      {
        "criterion_id": "P2",
        "severity": "low",
        "location": "SKILL.md:97-99",
        "comment": "更新履歴が1.1.0のみで作成時の履歴が無い。"
      }
    ]
  }
}
