{
  "schema": "skill-review-record/v1",
  "skill": "repo-hygiene-patrol",
  "reviewed_at": "2026-10-30T16:26:50Z",
  "target": {
    "files": [
      {
        "path": "SKILL.md",
        "sha256": "5f74848dc4150ff6370379a93c9745b22401edda0692e769174b92db5deb6f07"
      },
      {
        "path": "criteria/checks.json",
        "sha256": "f9a3c35def7b01af9e1cdbcb8a366e3f5adec127dcb768bcdd7095d8c8d6a0f2"
      }
    ],
    "content_hash": "23b7c13351c18e8475908d696f6337335a59ca336d0942c5aad7d3b587dbed9b"
  },
  "criteria": {
    "file": ".claude/skills/review-skill/criteria/skill-quality.json",
    "sha256": "58ca5348fd0c2d07f382ab4ffb5d3b6d546f756d638d1df6c01b2192afa32efb"
  },
  "best_practices_snapshot": {
    "fetched": "2026-10-27",
    "max_age_days": 30
  },
  "reviewer": {
    "kind": "subagent",
    "subagent_type": "general-purpose",
    "agent_id": "unavailable",
    "model": "claude-sonnet-5-5"
  },
  "result": {
    "axes": [
      {
        "id": "structure",
        "score": 19
      },
      {
        "id": "description",
        "score": 18
      },
      {
        "id": "instructions",
        "score": 19
      },
      {
        "id": "output",
        "score": 18
      },
      {
        "id": "practicality",
        "score": 18
      }
    ],
    "score": 92,
    "verdict": "PASS",
    "must_pass_failures": [],
    "findings": [
      {
        "criterion_id": "D3",
        "severity": "low",
        "location": "SKILL.md:3",
        "comment": "境界先の 'skills-audit' は実在の skill 名 audit-skill-system と一致しない。"
      },
      {
        "criterion_id": "I2",
        "severity": "low",
        "location": "SKILL.md:25",
        "comment": "各項目の実行前後のバリデーションゲートは、失敗時の対処以外に明示が無い。"
      },
      {
        "criterion_id": "P3",
        "severity": "low",
        "location": "SKILL.md:25",
        "comment": "numeric_target_drift の grep 対象 (CLAUDE.md .claude/ docs/) は規約依存。対象無し時の扱いは記載済み。"
      },
      {
        "criterion_id": "P2",
        "severity": "low",
        "location": "SKILL.md:96-100",
        "comment": "CLAUDE.md/README への反映は読み取った 2 つのパスだけでは確認できず、低めに採点。"
      }
    ]
  }
}
