{
  "schema": "skill-review-record/v1",
  "skill": "business-idea",
  "reviewed_at": "2026-10-30T16:06:54Z",
  "target": {
    "files": [
      {
        "path": "SKILL.md",
        "sha256": "61671abe378ad8b558835a654c48fc2c4e28cc15a664eebc5e04673c305c272f"
      },
      {
        "path": "references/dialogue-example.md",
        "sha256": "4daacc6f21504a364c291f9170069855800bc290e3a9f86844e955779b20306c"
      }
    ],
    "content_hash": "e55a3c17d45a5ae59969c0d3b4df9798b2751fa540c8e9640c12d480b8dd1053"
  },
  "criteria": {
    "file": ".claude/skills/review-skill/criteria/skill-quality.json",
    "sha256": "58ca5348fd0c2d07f382ab4ffb5d3b6d546f756d638d1df6c01b2192afa32efb"
  },
  "best_practices_snapshot": {
    "fetched": "2026-10-27",
    "max_age_days": 30
  },
  "reviewer": {
    "kind": "subagent",
    "subagent_type": "general-purpose",
    "agent_id": "unavailable",
    "model": "claude-sonnet-5-5"
  },
  "result": {
    "axes": [
      {
        "id": "structure",
        "score": 19
      },
      {
        "id": "description",
        "score": 19
      },
      {
        "id": "instructions",
        "score": 18
      },
      {
        "id": "output",
        "score": 17
      },
      {
        "id": "practicality",
        "score": 17
      }
    ],
    "score": 90,
    "verdict": "PASS",
    "must_pass_failures": [],
    "findings": [
      {
        "criterion_id": "P3",
        "severity": "low",
        "location": "SKILL.md:116",
        "comment": "repo 固有の参照パスあり。ただし無い環境では不要と明記済み"
      },
      {
        "criterion_id": "O3",
        "severity": "low",
        "location": "SKILL.md:108-112",
        "comment": "コード編集禁止等の制約は特に無し(対話型のため軽微)"
      }
    ]
  }
}
