{
  "schema": "skill-review-record/v1",
  "skill": "source-verification-scan",
  "reviewed_at": "2026-10-30T16:08:00Z",
  "target": {
    "files": [
      {
        "path": "SKILL.md",
        "sha256": "633a5ec3abc3700f6c1b27454c225ec1adb645753094999d4ec09ac7679f826b"
      },
      {
        "path": "criteria/categories.json",
        "sha256": "fefa5e90ee4d6ebad4b1c531489aaf7df2d42710003a61051866a50beee371b2"
      }
    ],
    "content_hash": "0e2715aec6b37e786ed44a93747f9d09e071a22420989cf57cee5bb76c2e7dd6"
  },
  "criteria": {
    "file": ".claude/skills/review-skill/criteria/skill-quality.json",
    "sha256": "58ca5348fd0c2d07f382ab4ffb5d3b6d546f756d638d1df6c01b2192afa32efb"
  },
  "best_practices_snapshot": {
    "fetched": "2026-10-27",
    "max_age_days": 30
  },
  "reviewer": {
    "kind": "subagent",
    "subagent_type": "general-purpose",
    "agent_id": "unavailable",
    "model": "claude-sonnet-5-5"
  },
  "result": {
    "axes": [
      {
        "id": "structure",
        "score": 19
      },
      {
        "id": "description",
        "score": 19
      },
      {
        "id": "instructions",
        "score": 19
      },
      {
        "id": "output",
        "score": 18
      },
      {
        "id": "practicality",
        "score": 17
      }
    ],
    "score": 92,
    "verdict": "PASS",
    "must_pass_failures": [],
    "findings": [
      {
        "criterion_id": "P1",
        "severity": "low",
        "location": "SKILL.md:5-6,39-41",
        "comment": "allowed-tools に Bash/Write が無いのに python 実行と一時 JSON 保存を指示(preapproval なので動作不可ではない)"
      },
      {
        "criterion_id": "P3",
        "severity": "low",
        "location": "SKILL.md:24",
        "comment": "_shared 依存。無い場合の省略手順は明記済み"
      }
    ]
  }
}
