{
  "schema": "skill-review-record/v1",
  "skill": "it-proposal",
  "reviewed_at": "2026-10-30T16:43:30Z",
  "target": {
    "files": [
      {
        "path": "SKILL.md",
        "sha256": "175caa37a858b699c4cfa93289344dbba6ff6b3896ca42d9ab322f28ffaad63f"
      },
      {
        "path": "references/proposal-template.md",
        "sha256": "ebad13b6b37eda254fa1672f77b7821ea81f281c8e37fde59b4bda7cdec414e2"
      },
      {
        "path": "references/self-diagnosis.md",
        "sha256": "9f5383dc8b98423afc76c6c71721078e78406453ba9b10fc343385a5dfac7544"
      }
    ],
    "content_hash": "6c70030b47d69b7bfe033526b4c722c51fc9b14dd52e0c22cc994ed21ffd7e99"
  },
  "criteria": {
    "file": ".claude/skills/review-skill/criteria/skill-quality.json",
    "sha256": "58ca5348fd0c2d07f382ab4ffb5d3b6d546f756d638d1df6c01b2192afa32efb"
  },
  "best_practices_snapshot": {
    "fetched": "2026-10-27",
    "max_age_days": 30
  },
  "reviewer": {
    "kind": "subagent",
    "subagent_type": "general-purpose",
    "agent_id": "unavailable",
    "model": "claude-sonnet-5-5"
  },
  "result": {
    "axes": [
      {
        "id": "structure",
        "score": 17
      },
      {
        "id": "description",
        "score": 19
      },
      {
        "id": "instructions",
        "score": 18
      },
      {
        "id": "output",
        "score": 18
      },
      {
        "id": "practicality",
        "score": 18
      }
    ],
    "score": 90,
    "verdict": "PASS",
    "must_pass_failures": [],
    "findings": [
      {
        "criterion_id": "S3",
        "severity": "low",
        "location": "it-proposal/references/proposal-template.md:1",
        "comment": "335 行あるが目次が無い(自己診断 md には目次あり)。出力テンプレートのため許容。"
      },
      {
        "criterion_id": "P3",
        "severity": "low",
        "location": "it-proposal/SKILL.md:16,132",
        "comment": "出元 repo 固有パス workflows/business-planning/it-proposal.md が残る(不要と明記済み)。"
      },
      {
        "criterion_id": "O2",
        "severity": "low",
        "location": "it-proposal/SKILL.md:24-26",
        "comment": "品質の自己検証は4項目のチェックのみで、採点軸や配点は無い(レビューは review-proposal に委譲)。"
      },
      {
        "criterion_id": "S1",
        "severity": "low",
        "location": "it-proposal/SKILL.md:16-17",
        "comment": "前提節の記述が冗長で一部重複(要点取り込み済みの説明が繰り返される)。"
      }
    ]
  }
}
